Name,Rating,Review,Date
Terence Crawford Vs Errol Spence Jr.,,,
Terence Crawford Vs Kell Brook,,,
Terence Crawford Vs Amir Khan,,,
Terence Crawford Vs Shawn Porter,,,
Terence Crawford Vs Derrick Campos,,,
Terence Crawford Vs Saul Alvarez,,,
Amir Khan Vs Kell Brook,,,
Amir Khan Vs Danny Garcia,,,
Amir Khan Vs Lamont Peterson,,,
Amir Khan Vs Breidis Prescott,,,
Amir Khan Vs Saul Alvarez,,,
Amir Khan Vs Phil Lo Greco,,,
Harry Fryer Vs Lewis Sylvester,,,
Sam Noakes Vs Lewis Sylvester,,,
David Haye Vs Valuev,,,
David Haye Vs Ruiz,,,
David Haye Vs Audley Harrison,,,
David Haye Vs Wladimir Klitschko,,,
Josh Warrington Vs Lee Selby,,,
Tyson Fury Vs Oleksandr Usyk I,,,
Tyson Fury Vs Oleksandr Usyk II,,,
Oleksandr Usyk Vs Daniel Dubois II,,,
Anthony Joshua Vs Povetkin,,,
Anthony Joshua Vs Oleksandr Usyk I,,,
Anthony Joshua Vs Oleksandr Usyk II,,,
Anthony Joshua Vs Andy Ruiz Jr. I,,,
Anthony Joshua Vs Andy Ruiz Jr. II,,,
Anthony Joshua Vs Wallin,,,
Anthony Joshua Vs Francis Ngannou,,,
Anthony Joshua Vs Daniel Dubois,,,
Anthony Joshua Vs Jake Paul,,,
Jake Paul Vs Mike Tyson,,,
Jake Paul Vs Tommy Fury,,,
Vasiliy Lomachenko Vs Rigondeux,,,
Vasiliy Lomachenko Vs Devin Haney,,,
Vasiliy Lomachenko Vs Teofimo Lopez,,,
Vasiliy Lomachenko Vs Linares,,,
Geroge Groves Vs Adamu,,,
George Groves Vs James DeGale,,,
Carl Froch Vs Geroge Groves I,,,
Carl Froch Vs Geroge Groves II,,,
Manny Pacquiao Vs Floyd Mayweather,,,
Manny Pacquiao Vs Ricky Hatton,,,
Manny Pacquiao Vs Juan Manuel Marquez IV,,,
Floyd Mayweather Vs Ricky Hatton,,,
Floyd Mayweather Vs Victor Ortiz,,,
Floyd Mayweather Vs Saul Alvarez,,,
Floyd Mayweather Vs Connor McGregor,,,
Jack Catterall Vs Josh Taylor,,,
Artur Beterbiev Vs Dmitry Bivol I,,,
Artur Beterbiev Vs Dmitry Bivol II,,,
Artur Beterbiev Vs Smith Jr,,,
Callum Smith Vs Joshua Buatsi,,,
Gennady Golovkin Vs Saul Alvarez I,,,
Gennady Golovkin Vs Saul Alvarez II,,,
Ben Whittaker Vs Liam Cameron I,,,
Ben Whittaker Vs Liam Cameron II,,,
Hamzah Sheeraz Vs Carlos Adames,,,
Chris Eubank Jr. Vs Liam Smith I,,,
Chris Eubank Jr. Vs Liam Smith II,,,
Chris Eubank Jr. Vs Connor Benn,,,
Connor Benn Vs Samuel Vargas,,,
Jack Bateson Vs Shabaz Masoud,,,
Jack Bateson Vs Danny Quartermain,,,
Gervonta Davis Vs Ryan Garcia,,,
Gervonta Davis Vs Lamont Roach,,,
Gervonta Davis Vs Frank Martin,,,
Chris Billam-Smith Vs Brandon Glanton,,,
Liam Smith Vs Aaron McKenna,,,
Israil Madrimov Vs Virgil Ortiz Jr.,,,
Naoya Inoue Vs Luis Nery,,,
Naoya Inoue Vs Kim,,,
Naoya Inoue Vs Moloney,,,
Naoya Inoue Vs McDonnell,,,
Naoya Inoue Vs Cardenas,,,
Naoya Inoue Vs Fulton,,,
Naoya Inoue Vs Doheny,,,
Naoya Inoue Vs Butler,,,
Naoya Inoue Vs Dasmarinas,,,
Naoya Inoue Vs Boyeaux,,,
Naoya Inoue Vs Parrenas,,,
Naoya Inoue Vs Rodriguez,,,
Naoya Inoue Vs Nonito Donaire I,,,
Naoya Inoue Vs Nonito Donaire II,,,
Naoya Inoue Vs Topales,,,
Naoya Inoue Vs Nieves,,,
Naoya Inoue Vs Sano,,,
Naoya Inoue Vs Basapean,,,
Naoya Inoue Vs Dipaen,,,
Naoya Inoue Vs Hernandez,,,
Naoya Inoue Vs Thammakhun,,,
Naoya Inoue Vs Murodjon Akhmadaliev,,,
Naoya Inoue Vs Alan Picasso,,,
Ryan Garcia Vs Rolly Romero,,,
Thomas Hearns Vs Roberto Duran,,,
Thomas Hearns Vs Marvin Hagler,,,
Dmitry Bivol Vs Saul Alvarez,,,
Junto Nakatani Vs Cuellar,,,
Junto Nakatani Vs Astrolabio,,,
Junto Nakatani Vs Acosta,,,
Junto Nakatani Vs Maloney,,,
Junto Nakatani Vs Chitpattana,,,
Junto Nakatani Vs Santiago,,,
Junto Nakatani Vs Nishida,,,
Junto Nakatani Vs Cortes,,,
Junto Nakatani Vs Sebastian Hernandez,,,
Qais Ashfaq Vs Masood Abdullah,,,
Qais Ashfaq Vs Marc Leach,,,
Masood Abdullah Vs Zak Miller,,,
Michael Conlan Vs Luis Alberto Lopez,,,
Michael Conlan Vs Leigh Wood,,,
Michael Conlan Vs Karim Guerfi,,,
Michael Conlan Vs Jordan Gill,,,
Leigh Wood Vs Josh Warrington,,,
Leigh Wood Vs Anthony Cacace,,,
Josh Warrington Vs Anthony Cacace,,,
Vasiliy Lomachenko Vs George Kambosos Jr.,,,
Galal Yafai Vs Charlie Edwards,,,
Jesse Rodriguez Vs Srisaket Sor Rungvisai,,,
Hayato Tsutsumi Vs Arboleda,,,
Hayato Tsutsumi Vs Ventura,,,
Hayato Tsutsumi Vs Alvarado,,,
Hayato Tsutsumi Vs Qais Ashfaq,,,
Reito Tsutsumi Vs Leobardo Quintana,,,
Shabaz Masoud Vs Liam Davies,,,
Hamzah Sheeraz Vs Edgar Berlanga,,,
Shakur Stevenson Vs Josh Padley,,,
Shakur Stevenson Vs William Zepeda,,,
Emiliano Vargas Vs Alexander Espinoza,,,
Kenshiro Teraji Vs Hekkis Budler,,,
Kenshiro Teraji Vs Olascuaga,,,
Kenshiro Teraji Vs Kyoghuchi,,,
Kenshiro Teraji Vs Rosales,,,
Kenshiro Teraji Vs Seigo Yuri Akui,,,
Mohammed Alakel Vs Yumnam Singh,,,
Raymond Ford Vs Abraham Nova,,,
Filip Hrgovic Vs David Adeleye,,,
Nick Ball Vs Sam Goodman,,,
Moses Itauma Vs Dillian Whyte,,,
Michael Conlan Vs Jack Bateson,,,
Murodjon Akhmadaliev Vs Luis Castillo,,,
Teofimo Lopez Vs George Kambosos Jr.,,,
Devin Haney Vs George Kambosos Jr.,,,
Luis Alberto Lopez Vs Angelo Leo,,,
David Benavidez Vs Anthony Yarde,,,
Abdullah Mason Vs Sam Noakes,,,
Devin Haney Vs Brian Norman Jr.,,,
Ben Whittaker Vs Benjamin Gavazi,,,
Jesse Rodriguez Vs Fernando Martinez,,,
Shabaz Masoud Vs Peter McGrail,,,
Taiga Imanaga Vs Eridson Garcia,,,